{
  "zone": "center-east",
  "owner": "WP-21",
  "map": "qingshuihe",
  "ops": [
    {
      "op": "add",
      "id": "design:center-east-pinxue-frame-edge",
      "kind": "contourSegment",
      "geometry": {
        "type": "polyline",
        "line": {
          "points": [
            [
              167.16,
              -41.98
            ],
            [
              161.82,
              -79.33
            ]
          ]
        }
      },
      "props": {
        "parent": "qsh:relation:11043355",
        "contour": "facade",
        "sourceId": "osm:way:797290174"
      },
      "reason": "D-243、D-239：登记本区现有生成布局和明确选段，保留原位置与朝向。"
    },
    {
      "op": "add",
      "id": "design:center-east-pinxue-bridge-ac-edge",
      "kind": "contourSegment",
      "geometry": {
        "type": "polyline",
        "line": {
          "points": [
            [
              245.36,
              -101.8
            ],
            [
              218.71,
              -98.09
            ]
          ]
        }
      },
      "props": {
        "parent": "qsh:relation:11043355",
        "contour": "facade",
        "sourceId": "osm:way:797290183"
      },
      "reason": "D-243：选取原 Bar 在标准化 facadePolygons 中使用的长边端点；物理轮廓的拼缝点不参与立面选段。"
    },
    {
      "op": "add",
      "id": "design:center-east-pinxue-bridge-bc-edge",
      "kind": "contourSegment",
      "geometry": {
        "type": "polyline",
        "line": {
          "points": [
            [
              226.39,
              -39.86
            ],
            [
              253.49,
              -43.58
            ]
          ]
        }
      },
      "props": {
        "parent": "qsh:relation:11043355",
        "contour": "facade",
        "sourceId": "osm:way:797290182"
      },
      "reason": "D-243：选取原 Bar 在标准化 facadePolygons 中使用的长边端点；物理轮廓的拼缝点不参与立面选段。"
    },
    {
      "op": "add",
      "id": "design:center-east-pinxue-arc-chord",
      "kind": "contourSegment",
      "geometry": {
        "type": "polyline",
        "line": {
          "points": [
            [
              156.26,
              29.09
            ],
            [
              168.75,
              38.45
            ]
          ]
        }
      },
      "props": {
        "parent": "design:center-east-pinxue-arc-end",
        "contour": "facade"
      },
      "reason": "D-243、D-239：登记本区现有生成布局和明确选段，保留原位置与朝向。"
    },
    {
      "op": "add",
      "id": "design:center-east-ke-a-hall-back",
      "kind": "contourSegment",
      "geometry": {
        "type": "polyline",
        "line": {
          "points": [
            [
              11.01,
              -51.29
            ],
            [
              14.26,
              -28.72
            ]
          ]
        }
      },
      "props": {
        "parent": "design:center-east-ke-a-lens-hall",
        "contour": "facade"
      },
      "reason": "D-243、D-239：登记本区现有生成布局和明确选段，保留原位置与朝向。"
    },
    {
      "op": "add",
      "id": "design:center-east-ke-b-hall-back",
      "kind": "contourSegment",
      "geometry": {
        "type": "polyline",
        "line": {
          "points": [
            [
              27.53,
              -159.84
            ],
            [
              30.54,
              -138.96
            ]
          ]
        }
      },
      "props": {
        "parent": "design:center-east-ke-b-lens-hall",
        "contour": "facade"
      },
      "reason": "D-243、D-239：登记本区现有生成布局和明确选段，保留原位置与朝向。"
    },
    {
      "op": "add",
      "id": "design:center-east-ke-c-hall-back",
      "kind": "contourSegment",
      "geometry": {
        "type": "polyline",
        "line": {
          "points": [
            [
              39.86,
              -186.57
            ],
            [
              40.87,
              -221.67
            ]
          ]
        }
      },
      "props": {
        "parent": "design:center-east-ke-c-lens-hall",
        "contour": "facade"
      },
      "reason": "D-243、D-239：登记本区现有生成布局和明确选段，保留原位置与朝向。"
    },
    {
      "op": "add",
      "id": "design:center-east-ke-a-stair-1",
      "kind": "siteLayout",
      "geometry": {
        "type": "point",
        "position": [
          -46.621078,
          0,
          -57.248276
        ]
      },
      "props": {},
      "reason": "D-243、D-239：登记本区现有生成布局和明确选段，保留原位置与朝向。"
    },
    {
      "op": "add",
      "id": "design:center-east-ke-a-stair-2",
      "kind": "siteLayout",
      "geometry": {
        "type": "point",
        "position": [
          -38.97939,
          0,
          -4.094776
        ]
      },
      "props": {},
      "reason": "D-243、D-239：登记本区现有生成布局和明确选段，保留原位置与朝向。"
    },
    {
      "op": "add",
      "id": "design:center-east-ke-a-stair-3",
      "kind": "siteLayout",
      "geometry": {
        "type": "point",
        "position": [
          22.669059,
          0,
          -64.381082
        ]
      },
      "props": {},
      "reason": "D-243、D-239：登记本区现有生成布局和明确选段，保留原位置与朝向。"
    },
    {
      "op": "add",
      "id": "design:center-east-ke-a-stair-4",
      "kind": "siteLayout",
      "geometry": {
        "type": "point",
        "position": [
          -55.535896,
          0,
          -31.416783
        ]
      },
      "props": {},
      "reason": "D-243、D-239：登记本区现有生成布局和明确选段，保留原位置与朝向。"
    },
    {
      "op": "add",
      "id": "design:center-east-ke-a-plant-1",
      "kind": "siteLayout",
      "geometry": {
        "type": "point",
        "position": [
          -9.0078,
          0,
          -62.655802
        ]
      },
      "props": {},
      "reason": "D-243、D-239：登记本区现有生成布局和明确选段，保留原位置与朝向。"
    },
    {
      "op": "add",
      "id": "design:center-east-ke-a-door-1",
      "kind": "siteLayout",
      "geometry": {
        "type": "point",
        "position": [
          31.954646,
          0,
          -39.145633
        ]
      },
      "props": {},
      "reason": "D-243、D-239：登记本区现有生成布局和明确选段，保留原位置与朝向。"
    },
    {
      "op": "add",
      "id": "design:center-east-ke-b-stair-1",
      "kind": "siteLayout",
      "geometry": {
        "type": "point",
        "position": [
          -63.84141,
          0,
          -162.973723
        ]
      },
      "props": {},
      "reason": "D-243、D-239：登记本区现有生成布局和明确选段，保留原位置与朝向。"
    },
    {
      "op": "add",
      "id": "design:center-east-ke-b-stair-2",
      "kind": "siteLayout",
      "geometry": {
        "type": "point",
        "position": [
          -56.1428,
          0,
          -109.424293
        ]
      },
      "props": {},
      "reason": "D-243、D-239：登记本区现有生成布局和明确选段，保留原位置与朝向。"
    },
    {
      "op": "add",
      "id": "design:center-east-ke-b-stair-3",
      "kind": "siteLayout",
      "geometry": {
        "type": "point",
        "position": [
          -21.340458,
          0,
          -142.816613
        ]
      },
      "props": {},
      "reason": "D-243、D-239：登记本区现有生成布局和明确选段，保留原位置与朝向。"
    },
    {
      "op": "add",
      "id": "design:center-east-ke-b-stair-4",
      "kind": "siteLayout",
      "geometry": {
        "type": "point",
        "position": [
          -74.536649,
          0,
          -135.471871
        ]
      },
      "props": {},
      "reason": "D-243、D-239：登记本区现有生成布局和明确选段，保留原位置与朝向。"
    },
    {
      "op": "add",
      "id": "design:center-east-ke-b-plant-1",
      "kind": "siteLayout",
      "geometry": {
        "type": "point",
        "position": [
          -6.651645,
          0,
          -116.539459
        ]
      },
      "props": {},
      "reason": "D-243、D-239：登记本区现有生成布局和明确选段，保留原位置与朝向。"
    },
    {
      "op": "add",
      "id": "design:center-east-ke-b-door-1",
      "kind": "siteLayout",
      "geometry": {
        "type": "point",
        "position": [
          50.903028,
          0,
          -152.596631
        ]
      },
      "props": {},
      "reason": "D-243、D-239：登记本区现有生成布局和明确选段，保留原位置与朝向。"
    },
    {
      "op": "add",
      "id": "design:center-east-ke-c-stair-1",
      "kind": "siteLayout",
      "geometry": {
        "type": "point",
        "position": [
          -26.741834,
          0,
          -221.14512
        ]
      },
      "props": {},
      "reason": "D-243、D-239：登记本区现有生成布局和明确选段，保留原位置与朝向。"
    },
    {
      "op": "add",
      "id": "design:center-east-ke-c-stair-2",
      "kind": "siteLayout",
      "geometry": {
        "type": "point",
        "position": [
          -28.147597,
          0,
          -195.787009
        ]
      },
      "props": {},
      "reason": "D-243、D-239：登记本区现有生成布局和明确选段，保留原位置与朝向。"
    },
    {
      "op": "add",
      "id": "design:center-east-ke-c-plant-1",
      "kind": "siteLayout",
      "geometry": {
        "type": "point",
        "position": [
          27.698436,
          0,
          -228.971803
        ]
      },
      "props": {},
      "reason": "D-243、D-239：登记本区现有生成布局和明确选段，保留原位置与朝向。"
    },
    {
      "op": "add",
      "id": "design:center-east-lin-placement",
      "kind": "siteLayout",
      "geometry": {
        "type": "point",
        "position": [
          89.8,
          0,
          -158.19
        ]
      },
      "props": {},
      "reason": "D-243、D-239：登记本区现有生成布局和明确选段，保留原位置与朝向。"
    }
  ]
}
