{
  "zone": "west",
  "owner": "WP-19",
  "map": "qingshuihe",
  "ops": [
    {
      "op": "add",
      "id": "design:west-six-shut-door-1",
      "kind": "layout",
      "geometry": {
        "type": "point",
        "position": [
          -804.19,
          0,
          160.62
        ]
      },
      "reason": "D-239：西区既有设计点位与造型控制线从生成器迁入覆盖层，保持原位置和形态。"
    },
    {
      "op": "add",
      "id": "design:west-six-shut-door-2",
      "kind": "layout",
      "geometry": {
        "type": "point",
        "position": [
          -728.73,
          0,
          217.39
        ]
      },
      "reason": "D-239：西区既有设计点位与造型控制线从生成器迁入覆盖层，保持原位置和形态。"
    },
    {
      "op": "add",
      "id": "design:west-six-shut-door-3",
      "kind": "layout",
      "geometry": {
        "type": "point",
        "position": [
          -601.64,
          0,
          275.48
        ]
      },
      "reason": "D-239：西区既有设计点位与造型控制线从生成器迁入覆盖层，保持原位置和形态。"
    },
    {
      "op": "add",
      "id": "design:west-six-plant-1",
      "kind": "layout",
      "geometry": {
        "type": "point",
        "position": [
          -804.1,
          0,
          99.8
        ]
      },
      "reason": "D-239：西区既有设计点位与造型控制线从生成器迁入覆盖层，保持原位置和形态。"
    },
    {
      "op": "add",
      "id": "design:west-six-plant-2",
      "kind": "layout",
      "geometry": {
        "type": "point",
        "position": [
          -732.2,
          0,
          117.3
        ]
      },
      "reason": "D-239：西区既有设计点位与造型控制线从生成器迁入覆盖层，保持原位置和形态。"
    },
    {
      "op": "add",
      "id": "design:west-six-plant-3",
      "kind": "layout",
      "geometry": {
        "type": "point",
        "position": [
          -607.1,
          0,
          267.4
        ]
      },
      "reason": "D-239：西区既有设计点位与造型控制线从生成器迁入覆盖层，保持原位置和形态。"
    },
    {
      "op": "add",
      "id": "design:west-four-door-a",
      "kind": "layout",
      "geometry": {
        "type": "point",
        "position": [
          -306.69,
          0,
          -357.83
        ]
      },
      "reason": "D-239：西区既有设计点位与造型控制线从生成器迁入覆盖层，保持原位置和形态。",
      "props": {
        "facing": 178.4
      }
    },
    {
      "op": "add",
      "id": "design:west-four-door-b",
      "kind": "layout",
      "geometry": {
        "type": "point",
        "position": [
          -359.35,
          0,
          -322.52
        ]
      },
      "reason": "D-239：西区既有设计点位与造型控制线从生成器迁入覆盖层，保持原位置和形态。",
      "props": {
        "facing": 128.4
      }
    },
    {
      "op": "add",
      "id": "design:west-four-door-c",
      "kind": "layout",
      "geometry": {
        "type": "point",
        "position": [
          -384.75,
          0,
          -262.87
        ]
      },
      "reason": "D-239：西区既有设计点位与造型控制线从生成器迁入覆盖层，保持原位置和形态。",
      "props": {
        "facing": 96.8
      }
    },
    {
      "op": "add",
      "id": "design:west-four-seat-arc-1",
      "kind": "layout",
      "geometry": {
        "type": "polyline",
        "line": {
          "points": [
            [
              -335.0,
              -211.0
            ],
            [
              -344.0,
              -220.0
            ],
            [
              -352.0,
              -230.0
            ],
            [
              -357.0,
              -241.0
            ],
            [
              -360.0,
              -252.0
            ]
          ]
        }
      },
      "reason": "D-239：西区既有设计点位与造型控制线从生成器迁入覆盖层，保持原位置和形态。"
    },
    {
      "op": "add",
      "id": "design:west-four-seat-arc-2",
      "kind": "layout",
      "geometry": {
        "type": "polyline",
        "line": {
          "points": [
            [
              -361.0,
              -259.0
            ],
            [
              -360.0,
              -271.0
            ],
            [
              -359.0,
              -282.0
            ],
            [
              -357.0,
              -291.0
            ],
            [
              -353.0,
              -300.0
            ]
          ]
        }
      },
      "reason": "D-239：西区既有设计点位与造型控制线从生成器迁入覆盖层，保持原位置和形态。"
    },
    {
      "op": "add",
      "id": "design:west-four-seat-arc-3",
      "kind": "layout",
      "geometry": {
        "type": "polyline",
        "line": {
          "points": [
            [
              -343.0,
              -316.0
            ],
            [
              -334.0,
              -324.0
            ],
            [
              -326.0,
              -330.0
            ],
            [
              -320.0,
              -333.0
            ],
            [
              -315.0,
              -334.0
            ],
            [
              -311.0,
              -334.5
            ]
          ]
        }
      },
      "reason": "D-239：西区既有设计点位与造型控制线从生成器迁入覆盖层，保持原位置和形态。"
    },
    {
      "op": "add",
      "id": "design:west-innovation-shaft-1",
      "kind": "layout",
      "geometry": {
        "type": "point",
        "position": [
          -591.9,
          0,
          77.2
        ]
      },
      "reason": "D-239：西区既有设计点位与造型控制线从生成器迁入覆盖层，保持原位置和形态。",
      "props": {
        "length": 6.2
      }
    },
    {
      "op": "add",
      "id": "design:west-innovation-shaft-2",
      "kind": "layout",
      "geometry": {
        "type": "point",
        "position": [
          -626.9,
          0,
          119.7
        ]
      },
      "reason": "D-239：西区既有设计点位与造型控制线从生成器迁入覆盖层，保持原位置和形态。",
      "props": {
        "length": 7
      }
    },
    {
      "op": "add",
      "id": "design:west-innovation-shaft-3",
      "kind": "layout",
      "geometry": {
        "type": "point",
        "position": [
          -553.4,
          0,
          106.4
        ]
      },
      "reason": "D-239：西区既有设计点位与造型控制线从生成器迁入覆盖层，保持原位置和形态。",
      "props": {
        "length": 6.6
      }
    },
    {
      "op": "add",
      "id": "design:west-innovation-shaft-4",
      "kind": "layout",
      "geometry": {
        "type": "point",
        "position": [
          -586.7,
          0,
          149.6
        ]
      },
      "reason": "D-239：西区既有设计点位与造型控制线从生成器迁入覆盖层，保持原位置和形态。",
      "props": {
        "length": 7.6
      }
    },
    {
      "op": "add",
      "id": "design:west-innovation-door",
      "kind": "layout",
      "geometry": {
        "type": "point",
        "position": [
          -564.7,
          0,
          134.12
        ]
      },
      "reason": "D-239：西区既有设计点位与造型控制线从生成器迁入覆盖层，保持原位置和形态。"
    },
    {
      "op": "add",
      "id": "design:west-boardwalk-route",
      "kind": "layout",
      "geometry": {
        "type": "polyline",
        "line": {
          "points": [
            [
              -236.6,
              -162.4
            ],
            [
              -233.5,
              -176.0
            ],
            [
              -236.0,
              -190.0
            ],
            [
              -236.4,
              -203.0
            ],
            [
              -233.0,
              -216.0
            ],
            [
              -221.5,
              -238.0
            ],
            [
              -205.5,
              -262.0
            ],
            [
              -195.0,
              -287.0
            ],
            [
              -193.0,
              -312.0
            ],
            [
              -198.0,
              -340.0
            ],
            [
              -206.0,
              -361.0
            ],
            [
              -211.5,
              -372.9
            ]
          ]
        }
      },
      "reason": "D-239：西区既有设计点位与造型控制线从生成器迁入覆盖层，保持原位置和形态。"
    },
    {
      "op": "add",
      "id": "design:west-wetland-beach",
      "kind": "layout",
      "geometry": {
        "type": "point",
        "position": [
          -240.4,
          0,
          -203.2
        ]
      },
      "reason": "D-239：西区既有设计点位与造型控制线从生成器迁入覆盖层，保持原位置和形态。"
    },
    {
      "op": "add",
      "id": "design:west-levee-stone-bridge",
      "kind": "layout",
      "geometry": {
        "type": "polyline",
        "line": {
          "points": [
            [
              -296.28,
              -164.94
            ],
            [
              -283.7,
              -160.1
            ]
          ]
        }
      },
      "reason": "D-239：西区既有设计点位与造型控制线从生成器迁入覆盖层，保持原位置和形态。"
    },
    {
      "op": "add",
      "id": "design:west-levee-lake-mouth",
      "kind": "layout",
      "geometry": {
        "type": "polyline",
        "line": {
          "points": [
            [
              -304,
              -154.9
            ],
            [
              -285.8,
              -147.8
            ]
          ]
        }
      },
      "reason": "D-239：西区既有设计点位与造型控制线从生成器迁入覆盖层，保持原位置和形态。"
    },
    {
      "op": "add",
      "id": "design:west-wetland-wade",
      "kind": "layout",
      "geometry": {
        "type": "polygon",
        "rings": {
          "outer": [
            [
              -241.2,
              -196.9
            ],
            [
              -243.1,
              -197.6
            ],
            [
              -243.4,
              -203.2
            ],
            [
              -243.1,
              -208.8
            ],
            [
              -241.2,
              -209.5
            ]
          ],
          "holes": []
        }
      },
      "reason": "D-239：迁移既有涉水卵石滩设计轮廓，未改变地形与涉水登记。"
    }
  ]
}
