{
  "zone": "core",
  "owner": "WP-16",
  "map": "qingshuihe",
  "ops": [
    {
      "op": "add",
      "id": "design:core-sundial",
      "kind": "sundial",
      "geometry": { "type": "point", "position": [-55.18, 0, 188.82] },
      "height": 2.4,
      "props": { "gnomonElevationDeg": 30.75, "waypoint": "P01" },
      "reason": "实物登记：日晷在 OSM 里没有要素，按 MAP-QSH-CORE §3 放在时间广场背向图书馆一侧的日晷林里，P01 视线正前方约 4.5 m（晷盘作前景、望穹顶）；晷针指正北、仰角 30.75°，是 3D 画面的指北针。夜间月光，四季见 MAP-QSH-CORE §7。"
    },
    {
      "op": "add",
      "id": "design:core-plaza-ring-steps",
      "kind": "steps",
      "geometry": { "type": "polygon", "rings": {"outer": [[-54.07, 137.95], [-54.3, 141.47], [-54.99, 144.92], [-56.12, 148.25], [-57.68, 151.41], [-59.63, 154.34], [-61.95, 156.98], [-64.6, 159.3], [-67.53, 161.26], [-70.68, 162.82], [-74.02, 163.95], [-77.47, 164.63], [-80.98, 164.86], [-84.49, 164.63], [-87.95, 163.95], [-91.28, 162.82], [-94.44, 161.26], [-97.36, 159.3], [-100.01, 156.98], [-102.33, 154.34], [-104.29, 151.41], [-105.84, 148.25], [-106.98, 144.92], [-107.66, 141.47], [-107.89, 137.95], [-107.66, 134.44], [-106.98, 130.99], [-105.84, 127.66], [-104.29, 124.5], [-102.33, 121.57], [-100.01, 118.93], [-97.36, 116.6], [-94.44, 114.65], [-91.28, 113.09], [-87.95, 111.96], [-84.49, 111.27], [-80.98, 111.04], [-77.47, 111.27], [-74.02, 111.96], [-70.68, 113.09], [-67.53, 114.65], [-64.6, 116.6], [-61.95, 118.93], [-59.63, 121.57], [-57.68, 124.5], [-56.12, 127.66], [-54.99, 130.99], [-54.3, 134.44]], "holes": [[[-56.17, 137.95], [-56.38, 141.19], [-57.02, 144.38], [-58.06, 147.45], [-59.5, 150.36], [-61.3, 153.06], [-63.44, 155.5], [-65.88, 157.64], [-68.58, 159.44], [-71.49, 160.88], [-74.56, 161.92], [-77.74, 162.55], [-80.98, 162.76], [-84.22, 162.55], [-87.4, 161.92], [-90.48, 160.88], [-93.39, 159.44], [-96.09, 157.64], [-98.53, 155.5], [-100.67, 153.06], [-102.47, 150.36], [-103.9, 147.45], [-104.95, 144.38], [-105.58, 141.19], [-105.79, 137.95], [-105.58, 134.72], [-104.95, 131.53], [-103.9, 128.46], [-102.47, 125.55], [-100.67, 122.85], [-98.53, 120.41], [-96.09, 118.27], [-93.39, 116.47], [-90.48, 115.03], [-87.4, 113.99], [-84.22, 113.36], [-80.98, 113.14], [-77.74, 113.36], [-74.56, 113.99], [-71.49, 115.03], [-68.58, 116.47], [-65.88, 118.27], [-63.44, 120.41], [-61.3, 122.85], [-59.5, 125.55], [-58.06, 128.46], [-57.02, 131.53], [-56.38, 134.72]]]} },
      "height": 0.9,
      "props": { "risers": 6, "riser": 0.15, "tread": 0.35, "footRadius": 24.81, "rimRadius": 26.91 },
      "reason": "构筑物登记（MAP-QSH-TERRAIN §2.2、§2.3）：下沉时间广场圆边一圈 6 级环形台阶（R 0.15、T 0.35、宽 2.1 m），东北、西南两处被 1:12 坡道截断；几何由 WP-16 的时间广场块按地形高差生成。登记它是为了让 core.terrain.json 里中轴走廊的 steps 区段指向一个真实的台阶构筑物。"
    },
    {
      "op": "add",
      "id": "design:core-plaza-bench-1",
      "kind": "bench",
      "geometry": { "type": "point", "position": [-53.13, 0, 141.74] },
      "height": 0.8,
      "reason": "设计增补（MAP-QSH-CORE 本区设计增补、MAP-QSH-ADDITIONS §7）：时间广场外圈路灯下的长椅，面朝广场与图书馆，给人留下停留的位置。默认状态接季（椅面积落叶）；夜间灯下；春樱瓣、夏树荫光斑、冬薄雪。可跳上（walk：可跳上，高约 0.45 m）。"
    },
    {
      "op": "add",
      "id": "design:core-plaza-bench-2",
      "kind": "bench",
      "geometry": { "type": "point", "position": [-63.96, 0, 160.33] },
      "height": 0.8,
      "reason": "设计增补：时间广场外圈路灯下的第二张长椅，同 design:core-plaza-bench-1。"
    },
    {
      "op": "add",
      "id": "design:core-plaza-bench-3",
      "kind": "bench",
      "geometry": { "type": "point", "position": [-84.77, 0, 165.81] },
      "height": 0.8,
      "reason": "设计增补：时间广场外圈路灯下的第三张长椅，同 design:core-plaza-bench-1。"
    },
    {
      "op": "reshape",
      "target": "qsh:way:806848398",
      "rings": {"outer": [[-142.29, 72.06], [-159.05, 93.94], [-143.02, 106.22], [-126.26, 84.34]], "holes": []},
      "level": "design",
      "reason": "构筑物定形（MAP-QSH-CORE §1.7）：大台阶基座 8398 按二楼正门的门轴对称重整为 27.56×20.2 m 的整块：中间两跑大台阶、两侧草坪台地、再外两侧侧梯与实心石护墙，后沿 3.45 m 顶平台接图书馆裙房平台。OSM 轮廓只画了台阶与台地（前块 18.5 m 宽，偏门轴 0.9 m），两侧侧梯在 OSM 侧路（842083674、842083676）上、未进轮廓；后沿与 OSM 同线，前沿与 OSM 相差 0.1 m 内，宽度两侧各补到后条宽。几何由 WP-16 的大台阶块生成。"
    },
    {
      "op": "add",
      "id": "design:core-library-camphor-1",
      "kind": "tree",
      "geometry": { "type": "point", "position": [-126.21, 0, 79.34] },
      "height": 14.0,
      "props": { "species": "camphor", "planter": "WP-23" },
      "reason": "实物登记（MAP-QSH-CORE §1.7）：大台阶两边各一株大冠香樟，这是东北侧一株，在侧梯石护墙外 4 m、台阶脚后 3 m，冠下留出侧梯脚与路。只给位置，树由 WP-23 种（WLD-VEGETATION 图书馆入口台地）。夜间剪影；春老叶少量转红，夏浓荫，秋冬常绿。"
    },
    {
      "op": "add",
      "id": "design:core-library-camphor-2",
      "kind": "tree",
      "geometry": { "type": "point", "position": [-147.83, 0, 107.58] },
      "height": 14.0,
      "props": { "species": "camphor", "planter": "WP-23" },
      "reason": "实物登记：大台阶西南侧的一株大冠香樟，与 design:core-library-camphor-1 对称，同上。"
    },
    {
      "op": "add",
      "id": "design:core-ginkgo-walk-west",
      "kind": "road",
      "geometry": { "type": "polyline", "line": { "points": [[-248.52, 514.55], [-230.5, 490.34], [-214.06, 468.49], [-201.09, 450.33], [-48.34, 247.54], [-9.12, 193.38], [76.02, 79.19], [76.54, 78.53], [76.79, 78.29], [76.84, 78.03], [77.18, 77.11], [79.0, 72.74], [79.15, 71.89], [80.03, 67.86], [80.6, 64.08], [80.49, 62.28], [80.34, 58.11], [76.08, 24.96]] } },
      "props": { "roadType": "footway", "width": 2.5, "night": "银杏大道路灯下", "seasons": "接季：铺装接银杏落叶、花瓣与积雪" },
      "reason": "设计增补：银杏大道南段（qsh:way:544688571）西北侧的树下步道，给银杏大道南段的休息点落脚，长椅由 WP-13 按步道自动摆（主会话 14:20 评审、14:26/28 定值）。中心线走 7 m 与 14 m 两列银杏正中，离路中 10.5 m，宽 2.5 m，17.5 m 春季粉带不动；几何取 Astra 的候选 Q(s)=P(s)−10.5·N(s)，按 3 cm 容差抽稀。南端：候选起点压主楼 B3 区，离墙 3 m 往北 7 m 就是主楼前步道 qsh:way:217855043，收在与它的交点上（离 B3 墙约 10 m），不留冲着墙的断头。北端：跨河桥前与西侧人行道 qsh:way:544161548 并上，收在住宅路 qsh:way:552968520 路缘前 0.5 m；过走马河走现有人行桥 qsh:way:988857960，不新建桥。中段与 OSM 西侧人行道 544161548（离路中 8.9–11.8 m）大段重合，铺装合成一条。铺装与收边由 WP-15 画。默认状态秋 17:30 树下落金叶；夜间银杏大道路灯下；四季接季"
    },
    {
      "op": "add",
      "id": "design:core-ginkgo-walk-east",
      "kind": "road",
      "geometry": { "type": "polyline", "line": { "points": [[-231.8, 527.26], [-213.68, 502.92], [-197.12, 480.89], [-184.15, 462.75], [-31.44, 260.02], [7.8, 205.82], [92.85, 91.75], [95.09, 88.61], [96.64, 85.01], [99.06, 78.94], [100.69, 71.58], [101.58, 65.16], [101.26, 56.37], [97.43, 26.3]] } },
      "props": { "roadType": "footway", "width": 2.5, "night": "银杏大道路灯下", "seasons": "接季：铺装接银杏落叶、花瓣与积雪" },
      "reason": "设计增补：银杏大道南段（qsh:way:544688571）东南侧的树下步道，与 design:core-ginkgo-walk-west 对称，给银杏大道南段的休息点落脚，长椅由 WP-13 按步道自动摆（主会话 14:20 评审、14:26/28 定值）。中心线离路中 10.5 m、宽 2.5 m，几何取 Astra 的候选 Q(s)=P(s)+10.5·N(s)，按 3 cm 容差抽稀。南端：候选起点压主楼 C1 区，收在主楼前环形步道 qsh:way:217855144 的交点上（离 C1 墙约 10 m）。北端：候选末 15 m 压走马河，在离水边 3 m 之前、住宅路 qsh:way:552968520 路缘前 0.5 m 收住，并在东侧人行道 qsh:way:544161558 上；过河走现有人行桥 qsh:way:988857962，不新建桥。中段与 OSM 东侧人行道 544161558（离路中 8.1–11.9 m）大段重合，铺装合成一条。铺装与收边由 WP-15 画。默认状态秋 17:30 树下落金叶；夜间银杏大道路灯下；四季接季"
    }
  ]
}
