{
  "zone": "core",
  "owner": "WP-16",
  "map": "qingshuihe",
  "ops": [
    {
      "op": "add",
      "id": "design:core-library-roof-face",
      "kind": "contourSegment",
      "geometry": {
        "type": "polyline",
        "line": {
          "points": [
            [
              -231.83,
              75.63
            ],
            [
              -237.07,
              37.72
            ]
          ]
        }
      },
      "props": {
        "parent": "qsh:way:806848396",
        "sourceId": "osm:way:806848395",
        "contour": "facade",
        "northFacet": 2
      },
      "reason": "MAP-QSH-CORE：登记既有造型使用的轮廓选段，保持当前朝向与构件位置。"
    },
    {
      "op": "add",
      "id": "design:core-library-front-face",
      "kind": "contourSegment",
      "geometry": {
        "type": "polyline",
        "line": {
          "points": [
            [
              -149.51,
              73.24
            ],
            [
              -159.7,
              86.72
            ]
          ]
        }
      },
      "props": {
        "parent": "qsh:way:806848396",
        "sourceId": "osm:way:806848392",
        "contour": "facade"
      },
      "reason": "MAP-QSH-CORE：登记既有造型使用的轮廓选段，保持当前朝向与构件位置。"
    },
    {
      "op": "add",
      "id": "design:core-library-cafe-face",
      "kind": "contourSegment",
      "geometry": {
        "type": "polyline",
        "line": {
          "points": [
            [
              -141.9,
              22.62
            ],
            [
              -135.81,
              63.6
            ]
          ]
        }
      },
      "props": {
        "parent": "qsh:way:806848396",
        "sourceId": "osm:way:806848397",
        "contour": "facade",
        "doorAt": "start"
      },
      "reason": "MAP-QSH-CORE：登记既有造型使用的轮廓选段，保持当前朝向与构件位置。"
    },
    {
      "op": "add",
      "id": "design:core-library-landing",
      "kind": "contourSegment",
      "geometry": {
        "type": "polyline",
        "line": {
          "points": [
            [
              -135.81,
              63.6
            ],
            [
              -158.34,
              93.01
            ]
          ]
        }
      },
      "props": {
        "parent": "qsh:way:806848396",
        "sourceId": "osm:way:806848397",
        "contour": "facade"
      },
      "reason": "MAP-QSH-CORE：登记既有造型使用的轮廓选段，保持当前朝向与构件位置。"
    },
    {
      "op": "add",
      "id": "design:core-annex-door-face",
      "kind": "contourSegment",
      "geometry": {
        "type": "polyline",
        "line": {
          "points": [
            [
              -170.17,
              -47.02
            ],
            [
              -117.24,
              -7.4
            ]
          ]
        }
      },
      "props": {
        "parent": "qsh:way:806848403",
        "sourceId": "osm:way:806848403",
        "contour": "facade"
      },
      "reason": "MAP-QSH-CORE：登记既有造型使用的轮廓选段，保持当前朝向与构件位置。"
    },
    {
      "op": "add",
      "id": "design:core-garden-pergola-face",
      "kind": "contourSegment",
      "geometry": {
        "type": "polyline",
        "line": {
          "points": [
            [
              -160.97,
              -8.57
            ],
            [
              -176.34,
              -19.23
            ]
          ]
        }
      },
      "props": {
        "parent": "qsh:way:806848406",
        "sourceId": "osm:way:806848406",
        "contour": "facade"
      },
      "reason": "MAP-QSH-CORE：登记既有造型使用的轮廓选段，保持当前朝向与构件位置。"
    },
    {
      "op": "add",
      "id": "design:core-garden-colonnade-face",
      "kind": "contourSegment",
      "geometry": {
        "type": "polyline",
        "line": {
          "points": [
            [
              -179.39,
              -7.1
            ],
            [
              -168.66,
              1.41
            ]
          ]
        }
      },
      "props": {
        "parent": "qsh:way:806848396",
        "sourceId": "osm:way:806848397",
        "contour": "facade"
      },
      "reason": "MAP-QSH-CORE：登记既有造型使用的轮廓选段，保持当前朝向与构件位置。"
    },
    {
      "op": "add",
      "id": "design:core-library-wing-setback-1",
      "kind": "contourSegment",
      "geometry": {
        "type": "polyline",
        "line": {
          "points": [
            [
              -228.39,
              83.96
            ],
            [
              -235.78,
              29.12
            ]
          ]
        }
      },
      "props": {
        "parent": "qsh:way:806848396",
        "sourceId": "osm:way:806848396",
        "contour": "facade"
      },
      "reason": "MAP-QSH-CORE：登记阅览翼五楼退台的既有外侧轮廓。"
    },
    {
      "op": "add",
      "id": "design:core-library-wing-setback-2",
      "kind": "contourSegment",
      "geometry": {
        "type": "polyline",
        "line": {
          "points": [
            [
              -160.9,
              85.82
            ],
            [
              -214.64,
              93.86
            ]
          ]
        }
      },
      "props": {
        "parent": "qsh:way:806848396",
        "sourceId": "osm:way:806848396",
        "contour": "facade"
      },
      "reason": "MAP-QSH-CORE：登记阅览翼五楼退台的既有外侧轮廓。"
    },
    {
      "op": "add",
      "id": "design:core-library-wing-setback-3",
      "kind": "contourSegment",
      "geometry": {
        "type": "polyline",
        "line": {
          "points": [
            [
              -158.08,
              18.14
            ],
            [
              -150.73,
              72.32
            ]
          ]
        }
      },
      "props": {
        "parent": "qsh:way:806848396",
        "sourceId": "osm:way:806848396",
        "contour": "facade"
      },
      "reason": "MAP-QSH-CORE：登记阅览翼五楼退台的既有外侧轮廓。"
    },
    {
      "op": "add",
      "id": "design:core-library-wing-setback-4",
      "kind": "contourSegment",
      "geometry": {
        "type": "polyline",
        "line": {
          "points": [
            [
              -225.66,
              15.58
            ],
            [
              -170.4,
              8.85
            ]
          ]
        }
      },
      "props": {
        "parent": "qsh:way:806848396",
        "sourceId": "osm:way:806848396",
        "contour": "facade"
      },
      "reason": "MAP-QSH-CORE：登记阅览翼五楼退台的既有外侧轮廓。"
    },
    {
      "op": "add",
      "id": "design:core-museum-south-face",
      "kind": "contourSegment",
      "geometry": {
        "type": "polyline",
        "line": {
          "points": [
            [
              -266.96,
              91.49
            ],
            [
              -304.31,
              96.56
            ]
          ]
        }
      },
      "props": {
        "parent": "qsh:way:806848402",
        "sourceId": "osm:way:806848401",
        "contour": "facade"
      },
      "reason": "MAP-QSH-CORE：登记既有造型使用的轮廓选段，保持当前朝向与构件位置。"
    },
    {
      "op": "add",
      "id": "design:core-museum-west-face",
      "kind": "contourSegment",
      "geometry": {
        "type": "polyline",
        "line": {
          "points": [
            [
              -312.6,
              90.6
            ],
            [
              -315.46,
              67.83
            ]
          ]
        }
      },
      "props": {
        "parent": "qsh:way:806848402",
        "sourceId": "osm:way:806848401",
        "contour": "facade"
      },
      "reason": "MAP-QSH-CORE：登记既有造型使用的轮廓选段，保持当前朝向与构件位置。"
    },
    {
      "op": "add",
      "id": "design:core-museum-north-face",
      "kind": "contourSegment",
      "geometry": {
        "type": "polyline",
        "line": {
          "points": [
            [
              -308.7,
              59.98
            ],
            [
              -273.08,
              53.67
            ]
          ]
        }
      },
      "props": {
        "parent": "qsh:way:806848402",
        "sourceId": "osm:way:806848401",
        "contour": "facade"
      },
      "reason": "MAP-QSH-CORE：登记既有造型使用的轮廓选段，保持当前朝向与构件位置。"
    },
    {
      "op": "add",
      "id": "design:core-museum-east-face",
      "kind": "contourSegment",
      "geometry": {
        "type": "polyline",
        "line": {
          "points": [
            [
              -263.78,
              60.92
            ],
            [
              -261.04,
              83.05
            ]
          ]
        }
      },
      "props": {
        "parent": "qsh:way:806848402",
        "sourceId": "osm:way:806848401",
        "contour": "facade"
      },
      "reason": "MAP-QSH-CORE：登记既有造型使用的轮廓选段，保持当前朝向与构件位置。"
    }
  ]
}
