{
  "zone": "public",
  "owner": "WP-29",
  "map": "qingshuihe",
  "ops": [
    {"op": "add", "id": "design:public-pocket-dangui-south", "kind": "road", "geometry": {"type": "polygon", "rings": {"outer": [[-106.72, -370.24], [-106.79, -369.54], [-106.99, -368.86], [-107.33, -368.24], [-107.77, -367.69], [-108.32, -367.25], [-108.94, -366.91], [-109.62, -366.71], [-110.32, -366.64], [-111.02, -366.71], [-111.7, -366.91], [-112.32, -367.25], [-112.87, -367.69], [-113.31, -368.24], [-113.65, -368.86], [-113.85, -369.54], [-113.92, -370.24], [-113.85, -370.94], [-113.65, -371.62], [-113.31, -372.24], [-112.87, -372.79], [-112.32, -373.23], [-111.7, -373.57], [-111.02, -373.77], [-110.32, -373.84], [-109.62, -373.77], [-108.94, -373.57], [-108.32, -373.23], [-107.77, -372.79], [-107.33, -372.24], [-106.99, -371.62], [-106.79, -370.94]], "holes": []}}, "props": {"roadType": "pedestrian", "surface": "paving_stones", "pocket": "design:public-pocket-dangui-south", "night": "月光", "seasons": "接季：铺装接落叶、花瓣与积雪"}, "reason": "设计增补（MAP-QSH-ADDITIONS 转角口袋绿地、§7 WP-29）：丹桂路南端与湿地北缘东西向干道 qsh:source:way:544161582 的丁字路口（约 (−116, −386)）以南，沿路北侧人行道 qsh:source:way:568042667 南沿的草地上，北部生活区与湿地公园、西门桥头之间。从西门桥头进校、从北区食堂往湿地和科研区走的人都经过这个路口；路口一带不属于任何区包已认领的楼、组团或广场（丹桂路的行道树与设计步道归 WP-20，湿地归 WP-19，本处都不碰），归 WP-29（D-185）。一块直径 7.2 m 的圆形铺装（WP-15 按广场铺，花岗岩收边），贴着路口但不压车道和人行道，人从路口一步就进来，是一处能停下来的地方。远处参照：越过路口往东北看丹桂路的桂花列和西北餐厅；背后往西南是湿地的水杉林；沿人行道走过时，先看见红枫在铺装上的长影，再看见树下的弧凳。默认状态：弧凳背面朝西南受光，树影长长地落在铺装上；夜间月光（孤树成剪影），无新增灯具；四季接季。walk：可走。"},
    {"op": "add", "id": "design:public-pocket-dangui-south-link", "kind": "road", "geometry": {"type": "polygon", "rings": {"outer": [[-109.38, -373.33], [-109.57, -375.56], [-111.97, -375.36], [-111.77, -373.13]], "holes": []}}, "props": {"roadType": "pedestrian", "surface": "paving_stones", "pocket": "design:public-pocket-dangui-south", "joins": "qsh:source:way:568042667", "night": "月光", "seasons": "接季"}, "reason": "设计增补：design:public-pocket-dangui-south 与路北人行道 qsh:source:way:568042667 之间的 2.4 m 铺装接口，从人行道中线接进圆形铺装，人不用踩草就能进来（与人行道铺装面重叠，由 WP-15 合成一片）。夜间月光；四季接季。walk：可走。"},
    {"op": "add", "id": "design:public-pocket-dangui-south-bench", "kind": "arc-bench", "geometry": {"type": "point", "position": [-110.32, 0, -370.24]}, "height": 0.86, "props": {"radius": 2.9, "from": 201.5, "to": 280.5, "seat": 0.44, "night": "月光", "seasons": "接季：坐面接落叶、花瓣与积雪"}, "reason": "设计增补（MAP-QSH-ADDITIONS）：design:public-pocket-dangui-south 上的弧形长凳，长 4 m（半径 2.9 m，方位 201.5°–280.5°，以 241° 为中），木条坐面、浅花岗岩墩、深灰钢靠背；坐的人朝东北看着树和路口，背面朝西南迎着落日受光（R1）。几何、碰撞与坐处由 WP-29 内容模块从本条生成。默认状态受光、接季；夜间月光；四季接季。walk：可跳上（坐面 0.44 m）。"},
    {"op": "add", "id": "design:public-pocket-dangui-south-tree", "kind": "tree-pit", "geometry": {"type": "point", "position": [-109.27, 0, -370.82]}, "height": 0.2, "props": {"plant": "tree", "perPit": 1, "species": "maple", "radius": 0.85, "kerb": 0.16, "soilAbove": 0.15, "stone": "site", "night": "月光", "seasons": "按树种四季"}, "reason": "设计增补（MAP-QSH-ADDITIONS）：design:public-pocket-dangui-south 的孤树，种在铺装东北部一个半径 0.85 m 的圆树池里（池框与土面由 WP-29 内容模块画，stone=site，WP-15 不重画），树由 WP-23 种：红枫（人行道边，树小，冠不压路），props.species 指定树种。树在凳的东北，落日把树影投向东北、不压弧凳的受光背面。默认状态长影；夜间月光（剪影）；四季按树种。walk：池框 0.2 m 自动登阶，树干碰撞归 WP-23。"},
    {"op": "add", "id": "design:public-pocket-canteen-west", "kind": "road", "geometry": {"type": "polygon", "rings": {"outer": [[-11.21, -327.35], [-11.29, -326.57], [-11.51, -325.82], [-11.88, -325.13], [-12.38, -324.52], [-12.99, -324.02], [-13.68, -323.65], [-14.43, -323.43], [-15.21, -323.35], [-15.99, -323.43], [-16.74, -323.65], [-17.43, -324.02], [-18.04, -324.52], [-18.54, -325.13], [-18.91, -325.82], [-19.13, -326.57], [-19.21, -327.35], [-19.13, -328.13], [-18.91, -328.88], [-18.54, -329.57], [-18.04, -330.18], [-17.43, -330.68], [-16.74, -331.05], [-15.99, -331.27], [-15.21, -331.35], [-14.43, -331.27], [-13.68, -331.05], [-12.99, -330.68], [-12.38, -330.18], [-11.88, -329.57], [-11.51, -328.88], [-11.29, -328.13]], "holes": []}}, "props": {"roadType": "pedestrian", "surface": "paving_stones", "pocket": "design:public-pocket-canteen-west", "night": "月光", "seasons": "接季：铺装接落叶、花瓣与积雪"}, "reason": "设计增补（MAP-QSH-ADDITIONS 转角口袋绿地、§7 WP-29）：芙蓉餐厅以南、银杏苑西南的 X 形路口（约 (1, −332)）的西角，湿地公园东缘草地与北区食堂草地之间。北区三个食堂往湿地和西门、往科研区的两条主路在这里交叉，路口四角都不属于任何区包已认领的楼、组团或广场；北角那片 osm:way:544166216 是 WP-20 的坐坡，本处在西角，不碰它。一块直径 8 m 的圆形铺装（WP-15 按广场铺，花岗岩收边），贴着路口但不压车道和人行道，人从路口一步就进来，是一处能停下来的地方。远处参照：越过路口往东北看芙蓉餐厅和银杏苑的台阶广场；背后是湿地的水杉林；从食堂出来往西走，先看见香樟下的一圈弧凳，再看见它背后的湿地。默认状态：弧凳背面朝西南受光，树影长长地落在铺装上；夜间月光（孤树成剪影），无新增灯具；四季接季。walk：可走。"},
    {"op": "add", "id": "design:public-pocket-canteen-west-link", "kind": "road", "geometry": {"type": "polygon", "rings": {"outer": [[-12.22, -329.37], [-10.89, -331.18], [-12.81, -332.6], [-14.15, -330.8]], "holes": []}}, "props": {"roadType": "pedestrian", "surface": "paving_stones", "pocket": "design:public-pocket-canteen-west", "joins": "qsh:source:way:568042667", "night": "月光", "seasons": "接季"}, "reason": "设计增补：design:public-pocket-canteen-west 与路北人行道 qsh:source:way:568042667 之间的 2.4 m 铺装接口，从人行道中线接进圆形铺装，人不用踩草就能进来（与人行道铺装面重叠，由 WP-15 合成一片）。夜间月光；四季接季。walk：可走。"},
    {"op": "add", "id": "design:public-pocket-canteen-west-bench", "kind": "arc-bench", "geometry": {"type": "point", "position": [-15.21, 0, -327.35]}, "height": 0.86, "props": {"radius": 3.2, "from": 205.2, "to": 276.8, "seat": 0.44, "night": "月光", "seasons": "接季：坐面接落叶、花瓣与积雪"}, "reason": "设计增补（MAP-QSH-ADDITIONS）：design:public-pocket-canteen-west 上的弧形长凳，长 4 m（半径 3.2 m，方位 205.2°–276.8°，以 241° 为中），木条坐面、浅花岗岩墩、深灰钢靠背；坐的人朝东北看着树和路口，背面朝西南迎着落日受光（R1）。几何、碰撞与坐处由 WP-29 内容模块从本条生成。默认状态受光、接季；夜间月光；四季接季。walk：可跳上（坐面 0.44 m）。"},
    {"op": "add", "id": "design:public-pocket-canteen-west-tree", "kind": "tree-pit", "geometry": {"type": "point", "position": [-14.07, 0, -327.98]}, "height": 0.2, "props": {"plant": "tree", "perPit": 1, "species": "camphor", "radius": 1.0, "kerb": 0.16, "soilAbove": 0.15, "stone": "site", "night": "月光", "seasons": "按树种四季"}, "reason": "设计增补（MAP-QSH-ADDITIONS）：design:public-pocket-canteen-west 的孤树，种在铺装东北部一个半径 1.0 m 的圆树池里（池框与土面由 WP-29 内容模块画，stone=site，WP-15 不重画），树由 WP-23 种：香樟（地宽，大冠给弧凳遮荫），props.species 指定树种。树在凳的东北，落日把树影投向东北、不压弧凳的受光背面。默认状态长影；夜间月光（剪影）；四季按树种。walk：池框 0.2 m 自动登阶，树干碰撞归 WP-23。"}
  ]
}
