{
  "zone": "south",
  "owner": "WP-18",
  "map": "qingshuihe",
  "ops": [
    {"op": "add", "id": "design:south-eastlake-swim-area", "kind": "swim-area", "geometry": {"type": "polygon", "rings": {"outer": [[257.5, 351.5], [245.5, 343.5], [240.5, 329.5], [237.5, 329.5], [225.0, 338.0], [179.5, 331.0], [174.0, 327.0], [173.0, 318.0], [171.0, 316.0], [162.5, 313.5], [158.0, 308.0], [151.5, 307.5], [145.0, 313.5], [114.0, 309.5], [112.5, 311.0], [112.0, 335.5], [26.5, 336.0], [22.5, 339.0], [22.5, 345.0], [11.5, 356.0], [-0.5, 361.0], [-9.5, 367.5], [-24.5, 384.0], [-24.5, 388.5], [-29.5, 395.5], [-30.0, 400.0], [-22.0, 411.0], [-12.5, 412.0], [-11.0, 408.0], [-15.0, 396.5], [-15.0, 388.0], [-12.0, 379.5], [-9.0, 376.5], [-1.5, 374.0], [8.0, 374.0], [28.5, 378.5], [38.5, 387.0], [42.5, 393.5], [42.0, 409.0], [35.0, 425.5], [28.5, 430.0], [17.5, 432.5], [9.5, 432.0], [6.5, 434.0], [6.5, 445.0], [4.5, 451.5], [-5.5, 463.5], [-17.0, 468.5], [-29.5, 468.5], [-37.5, 478.5], [-41.0, 486.5], [-39.5, 494.0], [-23.5, 512.5], [0.0, 526.0], [14.0, 537.0], [24.0, 541.5], [31.5, 541.0], [44.0, 527.5], [53.0, 510.5], [64.0, 501.5], [83.0, 499.0], [102.5, 503.5], [119.5, 499.0], [129.0, 490.5], [133.0, 483.5], [130.0, 459.0], [133.5, 452.0], [161.0, 426.5], [175.5, 405.5], [191.5, 392.0], [202.5, 386.5], [217.5, 384.5], [234.0, 378.0], [256.0, 356.0]], "holes": []}}, "reason": "游泳首版泳区（D-250，MAP-QSH-WATER §5）：东湖主水面，从水体多边形向内收 8 m，避开北部支汊口一带（暗涵口 12 m 与冬季浅滩一角，x<112、z<335）、西岸草阶看台前的荷区、东端桥与硬岸、湖心岛四周。"}
  ]
}
